{
  "required" : true ,
  "$schema" : "http://json-schema.org/draft-03/schema" ,
  "type" : "object" ,
  "properties" : {
    "self" : {
      "type" : "string" ,
      "required" : false
    } ,
    "id" : {
      "type" : "string" ,
      "required" : false
    } ,
    "name" : {
      "type" : "string" ,
      "required" : false
    } ,
    "description" : {
      "type" : "string" ,
      "required" : false
    } ,
    "owner" : {
      "type" : "object" ,
      "required" : false ,
      "properties" : {
        "self" : {
          "type" : "string" ,
          "required" : false
        } ,
        "name" : {
          "type" : "string" ,
          "required" : false
        } ,
        "avatarUrls" : {
          "type" : "object" ,
          "required" : false ,
          "properties" : {
            "24x24" : {
              "type" : "string" ,
              "required" : false
            } ,
            "16x16" : {
              "type" : "string" ,
              "required" : false
            } ,
            "32x32" : {
              "type" : "string" ,
              "required" : false
            } ,
            "48x48" : {
              "type" : "string" ,
              "required" : false
            }
          }
        } ,
        "displayName" : {
          "type" : "string" ,
          "required" : false
        } ,
        "active" : {
          "type" : "boolean" ,
          "required" : false
        }
      }
    } ,
    "jql" : {
      "type" : "string" ,
      "required" : false
    } ,
    "viewUrl" : {
      "type" : "string" ,
      "required" : false
    } ,
    "searchUrl" : {
      "type" : "string" ,
      "required" : false
    } ,
    "favourite" : {
      "type" : "boolean" ,
      "required" : false
    } ,
    "sharePermissions" : {
      "type" : "array" ,
      "required" : false ,
      "items" : [
      ]
    } ,
    "subscriptions" : {
      "type" : "object" ,
      "required" : false ,
      "properties" : {
        "size" : {
          "type" : "number" ,
          "required" : false
        } ,
        "items" : {
          "type" : "array" ,
          "required" : false ,
          "items" : [
          ]
        } ,
        "max-results" : {
          "type" : "number" ,
          "required" : false
        } ,
        "start-index" : {
          "type" : "number" ,
          "required" : false
        } ,
        "end-index" : {
          "type" : "number" ,
          "required" : false
        }
      }
    }
  }
}